{
  "$schema": "https://json-schema.org/draft/2020-12/schema",
  "$id": "https://github.com/HoodieJav13/football-os/blob/main/docs/export-format.schema.json",
  "title": "Football OS workspace backup (.footballos)",
  "description": "The envelope written by createWorkspaceBackup in src/workspaceData.js: backup format 2 wrapping a workspace at schema version 9. Every coordinate is in yards: x is yards right of the field's centre line, y is yards downfield of the line of scrimmage. Objects may carry extra keys; consumers must ignore keys they do not know.",
  "type": "object",
  "required": ["format", "formatVersion", "exportedAt", "workspace"],
  "properties": {
    "format": { "const": "football-os-workspace" },
    "formatVersion": {
      "description": "2 wraps a version-9 workspace. Format 1 (a version 5-8 percent-space workspace) is still accepted on import but is not described by this schema.",
      "const": 2
    },
    "exportedAt": {
      "type": "string",
      "format": "date-time",
      "pattern": "^\\d{4}-\\d{2}-\\d{2}T\\d{2}:\\d{2}:\\d{2}(\\.\\d+)?(Z|[+-]\\d{2}:\\d{2})$"
    },
    "workspace": { "$ref": "#/$defs/workspace" }
  },
  "$defs": {
    "workspace": {
      "type": "object",
      "required": ["version", "mainPlaybookId", "activePlaybookId", "playbooks"],
      "properties": {
        "version": { "const": 9 },
        "mainPlaybookId": {
          "description": "The id of the coach's working playbook (Personal Active). Always the id of one of `playbooks`.",
          "type": "string",
          "minLength": 1
        },
        "activePlaybookId": {
          "description": "The playbook that was open when the backup was written. Always the id of one of `playbooks`.",
          "type": "string",
          "minLength": 1
        },
        "playbooks": {
          "type": "array",
          "minItems": 1,
          "items": { "$ref": "#/$defs/playbook" }
        }
      }
    },

    "playbook": {
      "type": "object",
      "required": ["id", "name", "plays", "formations", "concepts"],
      "properties": {
        "id": { "type": "string", "minLength": 1 },
        "name": { "type": "string" },
        "description": { "type": "string" },
        "isMain": { "type": "boolean" },
        "source": {
          "description": "\"personal\" for the working playbook; otherwise the title of the published source the book was transcribed from.",
          "type": "string"
        },
        "formations": {
          "type": "array",
          "minItems": 1,
          "items": { "$ref": "#/$defs/formation" }
        },
        "concepts": {
          "type": "array",
          "items": { "$ref": "#/$defs/concept" }
        },
        "plays": {
          "type": "array",
          "minItems": 1,
          "items": { "$ref": "#/$defs/play" }
        }
      }
    },

    "play": {
      "type": "object",
      "required": [
        "id", "name", "players", "defenders", "assignments",
        "folder", "protection", "blockingScheme", "variantOf", "conceptTemplateId"
      ],
      "properties": {
        "id": { "type": "string", "minLength": 1 },
        "name": { "type": "string", "minLength": 1 },
        "family": { "type": "string" },
        "personnel": { "type": "string" },
        "formation": {
          "description": "The formation's display name, not a formation id. It is a label on the play; the roster below is the play's own copy.",
          "type": "string"
        },
        "folder": { "type": "string" },
        "protection": { "type": "string" },
        "blockingScheme": { "type": "string" },
        "variantOf": {
          "description": "The id of the play this one was duplicated from as a variation, or null. Ids are unique within a playbook, not globally.",
          "type": ["string", "null"]
        },
        "conceptTemplateId": {
          "description": "The id of the concept last applied to this play (in the same playbook's `concepts`), or null.",
          "type": ["string", "null"]
        },
        "sourcePage": {
          "description": "Page number in the published source this play was transcribed from, or null for a coach-authored play.",
          "type": ["integer", "null"]
        },
        "sourceLabel": {
          "description": "Title of the published source, or null.",
          "type": ["string", "null"]
        },
        "importedFrom": {
          "description": "Present on a play copied into the working playbook from another book: where it came from. The copy is independent; this is a record, not a link.",
          "type": "object",
          "required": ["playbookId", "playbookName", "playId"],
          "properties": {
            "playbookId": { "type": "string" },
            "playbookName": { "type": "string" },
            "playId": { "type": "string" },
            "sourcePage": { "type": ["integer", "null"] }
          }
        },
        "players": {
          "description": "Offensive roster. A legal formation has exactly eleven, but a draft may not.",
          "type": "array",
          "items": { "$ref": "#/$defs/player" }
        },
        "defenders": {
          "description": "The opponent look.",
          "type": "array",
          "items": { "$ref": "#/$defs/player" }
        },
        "assignments": {
          "type": "array",
          "items": {
            "allOf": [
              { "$ref": "#/$defs/assignment" },
              { "type": "object", "required": ["templateOverride"] }
            ]
          }
        }
      }
    },

    "player": {
      "description": "Offence and defence share one shape. `id` is the stable identity that assignments reference; `label` is coach-visible and may be duplicated on a unit (two defensive `T`s are legal).",
      "type": "object",
      "required": ["id", "label", "x", "y"],
      "properties": {
        "id": { "type": "string", "minLength": 1 },
        "label": { "type": "string" },
        "x": { "$ref": "#/$defs/yards" },
        "y": { "$ref": "#/$defs/yards" }
      }
    },

    "yards": { "type": "number" },

    "point": {
      "description": "[x, y] in yards.",
      "type": "array",
      "prefixItems": [{ "$ref": "#/$defs/yards" }, { "$ref": "#/$defs/yards" }],
      "items": false,
      "minItems": 2,
      "maxItems": 2
    },

    "assignmentBase": {
      "type": "object",
      "required": ["id", "playerId", "unit", "type", "phase", "pace", "delay", "points", "definition"],
      "properties": {
        "id": { "type": "string", "minLength": 1 },
        "playerId": {
          "description": "The `id` of a player in this play's `players` (offense) or `defenders` (defense). Never a label.",
          "type": "string",
          "minLength": 1
        },
        "unit": { "enum": ["offense", "defense"] },
        "type": { "enum": ["Route", "Block", "Motion", "Rush", "Man", "Zone", "Fit"] },
        "phase": {
          "description": "The slot the assignment occupies: Motion is pre-snap, everything else post-snap.",
          "enum": ["pre", "post"]
        },
        "preset": {
          "description": "Coach-facing name for the assignment (\"Corner\", \"Jet\", \"Structured\", \"Custom\"). Display only; the geometry is in `points` and `definition`.",
          "type": "string"
        },
        "pace": {
          "description": "Speed multiplier for playback; 1 is normal.",
          "type": "number",
          "exclusiveMinimum": 0
        },
        "delay": {
          "description": "Start offset in seconds relative to the snap. Motions default to -1.5 (pre-snap); everything else defaults to 0.",
          "type": "number"
        },
        "points": {
          "description": "The path the player runs, in yards, starting at the player's alignment. This is the rendered geometry and the only thing a consumer needs to draw the assignment.",
          "type": "array",
          "minItems": 2,
          "items": { "$ref": "#/$defs/point" }
        },
        "definition": { "type": "object" },
        "templateOverride": {
          "description": "True when the coach edited this assignment after a concept supplied it, so a later reapplication of the concept must leave it alone. Always present on a play's assignments; absent from a concept's.",
          "type": "boolean"
        },
        "inheritedFrom": {
          "description": "Present when a concept supplied the assignment.",
          "type": "object",
          "required": ["conceptId", "conceptName", "assignmentId"],
          "properties": {
            "conceptId": { "type": "string" },
            "conceptName": { "type": "string" },
            "assignmentId": { "type": "string" }
          }
        }
      }
    },

    "assignment": {
      "allOf": [
        { "$ref": "#/$defs/assignmentBase" },
        {
          "oneOf": [
            { "$ref": "#/$defs/routeAssignment" },
            { "$ref": "#/$defs/blockAssignment" },
            { "$ref": "#/$defs/motionAssignment" },
            { "$ref": "#/$defs/rushAssignment" },
            { "$ref": "#/$defs/manAssignment" },
            { "$ref": "#/$defs/zoneAssignment" },
            { "$ref": "#/$defs/fitAssignment" }
          ]
        }
      ]
    },

    "routeAssignment": {
      "type": "object",
      "required": ["type", "definition", "geometryMode", "evidence"],
      "properties": {
        "type": { "const": "Route" },
        "unit": { "const": "offense" },
        "definition": { "$ref": "#/$defs/routeDefinition" },
        "geometryMode": {
          "description": "How `points` relate to `definition`: `structured` means the points were generated from the definition; `detected` means the definition was inferred from points traced off a diagram; `manual` means the coach dragged a landmark and the points are the truth.",
          "enum": ["structured", "detected", "manual"]
        },
        "evidence": { "$ref": "#/$defs/routeEvidence" }
      }
    },

    "routeDefinition": {
      "description": "The football definition of a receiver route. `points` is generated from it unless `geometryMode` is `manual`.",
      "type": "object",
      "required": ["release", "stemYards", "breaks", "condition"],
      "properties": {
        "release": { "enum": ["none", "inside", "outside", "best"] },
        "stemYards": { "type": "number", "minimum": 0, "maximum": 40 },
        "breaks": {
          "description": "Ordered break segments after the stem. A double move is two entries.",
          "type": "array",
          "maxItems": 4,
          "items": { "$ref": "#/$defs/routeBreak" }
        },
        "condition": {
          "description": "A conversion rule kept as prose (\"Read man/zone\"), never collapsed into one path.",
          "type": "string"
        }
      }
    },

    "routeBreak": {
      "type": "object",
      "required": ["direction", "angle", "distanceYards"],
      "properties": {
        "direction": { "enum": ["inside", "outside", "vertical"] },
        "angle": {
          "description": "Degrees off vertical; always 0 for a vertical break.",
          "type": "number",
          "minimum": 0,
          "maximum": 135
        },
        "distanceYards": { "type": "number", "minimum": 0, "maximum": 40 }
      }
    },

    "routeEvidence": {
      "description": "Where the route came from and how much to trust it. Known `method` values: existing-diagram, diagram-geometry, labels-and-geometry, coach-authored, coach-copied. Known `confidence` values: medium, medium-high, high. Both are open strings because a coach edit carries the previous evidence forward.",
      "type": "object",
      "required": ["method", "confidence", "coachEdited"],
      "properties": {
        "method": { "type": "string", "minLength": 1 },
        "confidence": { "type": "string", "minLength": 1 },
        "sourceLabel": { "type": ["string", "null"] },
        "sourcePage": { "type": ["integer", "null"] },
        "note": { "type": "string" },
        "coachEdited": { "type": "boolean" }
      }
    },

    "blockAssignment": {
      "type": "object",
      "required": ["type", "definition"],
      "properties": {
        "type": { "const": "Block" },
        "unit": { "const": "offense" },
        "definition": {
          "type": "object",
          "required": ["technique", "direction", "target", "climb"],
          "properties": {
            "technique": { "enum": ["drive", "reach", "down", "double", "pull", "wrap", "kick-out", "pass-set", "combo"] },
            "direction": { "enum": ["left", "right"] },
            "target": {
              "description": "A defender label the block aims at, as coach-entered prose. Not an id.",
              "type": "string"
            },
            "climb": { "type": "boolean" }
          }
        }
      }
    },

    "motionAssignment": {
      "type": "object",
      "required": ["type", "definition"],
      "properties": {
        "type": { "const": "Motion" },
        "unit": { "const": "offense" },
        "phase": { "const": "pre" },
        "definition": {
          "type": "object",
          "required": ["motionType", "direction", "distanceYards"],
          "properties": {
            "motionType": { "enum": ["jet", "orbit", "return", "shift", "trade"] },
            "direction": { "enum": ["left", "right"] },
            "distanceYards": { "type": "number", "minimum": 2, "maximum": 40 }
          }
        }
      }
    },

    "rushAssignment": {
      "type": "object",
      "required": ["type", "definition"],
      "properties": {
        "type": { "const": "Rush" },
        "unit": { "const": "defense" },
        "definition": {
          "type": "object",
          "required": ["technique", "gap", "direction"],
          "properties": {
            "technique": { "enum": ["rush", "contain", "blitz", "stunt"] },
            "gap": { "enum": ["A", "B", "C", "D"] },
            "direction": { "enum": ["left", "right"] }
          }
        }
      }
    },

    "manAssignment": {
      "type": "object",
      "required": ["type", "definition"],
      "properties": {
        "type": { "const": "Man" },
        "unit": { "const": "defense" },
        "definition": {
          "type": "object",
          "required": ["targetId", "leverage"],
          "properties": {
            "targetId": {
              "description": "The `id` of the offensive player being covered, or an empty string when unassigned.",
              "type": "string"
            },
            "leverage": { "enum": ["inside", "outside", "head-up"] }
          }
        }
      }
    },

    "zoneAssignment": {
      "type": "object",
      "required": ["type", "definition"],
      "properties": {
        "type": { "const": "Zone" },
        "unit": { "const": "defense" },
        "definition": {
          "type": "object",
          "required": ["area", "landmark"],
          "properties": {
            "area": { "enum": ["flat", "hook", "curl", "deep-third", "deep-half", "quarter"] },
            "landmark": { "type": "string" }
          }
        }
      }
    },

    "fitAssignment": {
      "type": "object",
      "required": ["type", "definition"],
      "properties": {
        "type": { "const": "Fit" },
        "unit": { "const": "defense" },
        "definition": {
          "type": "object",
          "required": ["responsibility", "technique"],
          "properties": {
            "responsibility": { "enum": ["A", "B", "C", "D", "force", "cutback"] },
            "technique": { "enum": ["spill", "box", "lever"] }
          }
        }
      }
    },

    "formation": {
      "description": "A reusable offensive alignment: labels and positions only, never assignments.",
      "type": "object",
      "required": ["id", "name", "players"],
      "properties": {
        "id": { "type": "string", "minLength": 1 },
        "name": { "type": "string" },
        "personnel": { "type": "string" },
        "players": {
          "type": "array",
          "items": { "$ref": "#/$defs/player" }
        }
      }
    },

    "concept": {
      "description": "A reusable set of assignments keyed by position label, with the roster it was captured from so landmarks can be translated onto another play.",
      "type": "object",
      "required": ["id", "name", "players", "defenders", "assignments"],
      "properties": {
        "id": { "type": "string", "minLength": 1 },
        "name": { "type": "string", "minLength": 1 },
        "sourceFormation": { "type": "string" },
        "sourcePersonnel": { "type": "string" },
        "players": { "type": "array", "items": { "$ref": "#/$defs/player" } },
        "defenders": { "type": "array", "items": { "$ref": "#/$defs/player" } },
        "assignments": {
          "type": "array",
          "items": {
            "allOf": [
              { "$ref": "#/$defs/assignment" },
              {
                "type": "object",
                "required": ["positionLabel"],
                "properties": {
                  "positionLabel": {
                    "description": "The label the assignment transfers by. `playerId` still names the player in the concept's own roster.",
                    "type": "string",
                    "minLength": 1
                  }
                }
              }
            ]
          }
        }
      }
    }
  }
}
